{
  "$schema": "./Config.schema.json",
  "name": "distinct-count",
  "description": "Corpus problem: several test cases per input file, judged by the standard checker ncmp. True verdicts of its mutants are pinned in corpus/expected.",

  "timeLimit": 2000,
  "memoryLimit": 256,
  "inputFile": "stdin",
  "outputFile": "stdout",
  "interactive": false,

  "tags": ["implementation", "sortings"],

  "statements": {
    "english": {
      "encoding": "UTF-8",
      "name": "Distinct Values, Many Times",
      "legend": "./statements/english/legend.tex",
      "input": "./statements/english/input-format.tex",
      "output": "./statements/english/output-format.tex",
      "notes": "./statements/english/notes.tex"
    }
  },

  "solutions": [
    {
      "name": "main",
      "source": "./solutions/acc.cpp",
      "tag": "MA",
      "sourceType": "cpp.g++17"
    },
    {
      "name": "ok_java",
      "source": "./solutions/ok_java.java",
      "tag": "OK",
      "sourceType": "java21"
    },
    {
      "name": "ok_python",
      "source": "./solutions/ok_python.py",
      "tag": "OK",
      "sourceType": "python.3"
    },
    {
      "name": "wa_no_reset",
      "source": "./solutions/wa_no_reset.cpp",
      "tag": "WA",
      "sourceType": "cpp.g++17"
    },
    {
      "name": "wa_first_case",
      "source": "./solutions/wa_first_case.py",
      "tag": "WA",
      "sourceType": "python.3"
    },
    {
      "name": "pe_case_label",
      "source": "./solutions/pe_case_label.cpp",
      "tag": "PE",
      "sourceType": "cpp.g++17"
    },
    {
      "name": "re_vector_at",
      "source": "./solutions/re_vector_at.cpp",
      "tag": "RE",
      "sourceType": "cpp.g++17"
    }
  ],

  "generators": [
    {
      "name": "gen",
      "source": "./generators/gen.cpp"
    }
  ],

  "checker": {
    "name": "ncmp",
    "source": "ncmp.cpp",
    "isStandard": true
  },

  "validator": {
    "name": "validator",
    "source": "./validator/val.cpp",
    "testsFilePath": "./validator/validator_tests.json"
  },

  "testsets": [
    {
      "name": "tests",
      "generatorScript": {
        "scriptFile": "./generators/gen-script.txt"
      },
      "manualTests": [
        {
          "input": "./manual/tests/m-01-sample.in",
          "index": 1,
          "group": "samples",
          "useInStatements": true
        }
      ],
      "groupsEnabled": true,
      "groups": [
        { "name": "samples" },
        { "name": "main" }
      ]
    }
  ]
}
